filename,court,full_text_len,background_raw_len,background_clean_len,background_raw,background_clean
azd-2_22-cv-02126.pdf,azd,45120,8306,8125,"A. The Parties 1. Plaintiffs Plaintiff UANPF is a Virginia-based, multi-employer defined benefit pension plan. (Doc. 36 ¶ 18.) UANPF is one of the nation’s largest Taft-Hartley funds with approximately $6.5 billion in assets held for the benefit of approximately 150,000 participants. (Id.) UANPF alleges it purchased a significant number of shares of Carvana Class A common stock at artificially inflated prices from May 6, 2020 to November 3, 2020 (the “Class Period”) and suffered damages from Defendants’ alleged misconduct. (Id.) On April 22, 2022, UANPF also purchased 1,455 shares of Class A common stock in the 2022 Public Offering (the “Offering”) from Citigroup Global Markets Inc. for $80.00 per share. (Id.) Plaintiff SHEPP is the largest defined benefit plan in the Canadian province of Saskatchewan. (Id. ¶ 19.) It is a multi-employer defined benefit pension plan serving the healthcare sector, with over 60,000 members and more than $10 billion in assets under management. (Id.) SHEPP alleges it purchased a significant number of shares of Carvana Class A common stock at artificially inflated prices during the Class Period and suffered damages as a result of Defendants’ alleged misconduct. (Id.) On April 22, 2022, SHEPP purchased 3,838 shares of Class A common stock in the Offering from Citigroup Global Markets Inc. for $80.00 per share. (Id.) 2. Defendants Defendant Carvana Co. is a Delaware corporation with its principal executive offices located in Tempe, Arizona. (Doc. 36 ¶ 20.) Carvana’s Class A common stock trades on the New York Stock Exchange (“NYSE”) under the symbol “CVNA.” (Id.) Defendant Ernest Garcia III (“Garcia Junior”) is a co-founder of Carvana and has served as its Chief Executive Officer, President, and Chairman since 2012. (Id. ¶ 21.) His father is Defendant Ernest Garcia II (“Garcia Senior”), who is also a founder of Carvana. (Id. ¶¶ 21, 23.) Garcia Senior is Carvana’s controlling shareholder. (Id. ¶ 23.) Plaintiffs allege that Garcia Senior was the largest single seller of Carvana stock throughout the Class Period and sold over $3.6 billion in Class A common stock at artificially inflated prices. (Id.) Plaintiffs also allege that Garcia Senior and Garcia Junior were next-door neighbors during the Class Period. (Id.) Defendant Mark Jenkins is Carvana’s Chief Financial Officer. (Id. ¶ 22.) Plaintiffs allege that during the Class Period, Defendant Jenkins sold 336,929 shares, nearly 34% of his holdings, at artificially inflated prices for proceeds of $79,246,195. (Id.) Defendant Ryan Keeton is a co-founder of Carvana and serves as its Chief Brand Officer. (Id. ¶ 24.) During the Class Period, Plaintiffs allege Keeton sold 180,007 shares of Carvana stock, or nearly 63% of his stock, at artificially inflated prices for proceeds of more than $42.3 million. (Id.) Defendant Benjamin Huston is a co-founder of Carvana and serves as its Chief Operating Officer. (Id. ¶ 25.) During the Class Period, Huston sold 336,937 shares of Carvana stock, or more than 34% of his stock at, allegedly, artificially inflated prices, for proceeds of nearly $79.3 million. (Id.) Huston was responsible for Carvana operations, including inventory management and wholesale, inspection and reconditioning, logistics and fulfillment, customer service operations, real estate, and market expansion. (Id.) Plaintiffs allege that these Defendants—Carvana, Garcia Junior, Jenkins, Garcia Senior, Keeton, and Huston (collectively, the “Exchange Act Defendants”)—violated Section 10(b), Rule 10b-5, Section 20(a), and Section 20A of the Securities Exchange Act. Defendant Stephen Palmer served as Carvana’s Vice President of Accounting and Finance and signed the Registration Statement issued in connection with the 2022 Public Offering. (Id. ¶ 414.) Defendants Michael Maroone, Neha Parikh, Ira Platt, and Greg Sullivan each served as members of Carvana’s Board of Directors and signed the Registration Statement issued in connection with the Offering. (Id. ¶ 415.) Plaintiffs allege that these Defendants—Palmer, Maroone, Parikh, Platt, and Sullivan—together with Carvana, Garcia Junior, and Jenkins (collectively the “Individual Securities Act Defendants”) violated Section 11, Section 12(a)(2), and Section 15 of the Securities Act. 3. Underwriter Defendants Plaintiffs allege Defendants Citigroup Global Markets Inc. and J.P. Morgan Securities LLC acted as underwriters and/or underwriter representatives of, and as sellers in, Carvana’s 2022 Public Offering (collectively, the “Underwriter Defendants”). (Id. ¶ 416.) Plaintiffs allege that in connection with the 2022 Public Offering, the Underwriter Defendants marketed Carvana common stock to potential investors using materially false or misleading information about the Company, or omitted material information required to be disclosed in the Registration Statement. (Id. ¶ 417.) Plaintiffs also allege that the Underwriter Defendants caused the Registration Statement to be filed with the SEC and to be declared effective in connection with the 2022 Public Offering. (Id.) Plaintiffs claim this conduct deems them liable under the Securities Act. (Id.) B. Carvana’s Founding & Business Model Plaintiffs allege that Garcia Senior and his son, Garcia Junior—along with Keeton and Huston—founded Carvana as a wholly owned subsidiary of DriveTime Automotive (“DriveTime”), which was Garcia Senior’s used car business. (Id. ¶¶ 4, 39, 41.) Carvana described itself as an “e-commerce company dealing in used cars” and “the Amazon of the used car industry.” (Id. ¶ 2.) In 2017, the Garcias took Carvana public on the NYSE and pitched it as “a disrupter and innovator in the used car market.” (Id. ¶ 41.) The Consolidated Complaint alleges Carvana marketed itself as a “seemingly limitless growth machine because the Company’s disruptive model was full of competitive advantages, such as a ‘capital-light’ expansion model, a scalable business model, and a groundbreaking logistics network that could readily deliver or pick-up cars nationwide.” (Id. ¶ 2.) The Exchange Act Defendants marketed to investors that Carvana’s “business gets better as it gets bigger.” (Id.) Garcia Junior advertised that “a unique attribute of our business model relative to automotive retail and then not unique relative to e-commerce is that all of our cars are available to customers everywhere” and “you’re increasing conversion across all of your markets . . . we feel really, really good about that model.” (Id. ¶ 55.) Carvana held its “first and only Analyst Day” on November 29, 2018. (Id. ¶ 53.) There, Garcia Junior broadcasted that Carvana’s “long-term goal was to sell two million- plus units a year to become the largest automotive retailer.” (Id.) Plaintiffs further allege the Exchange Act Defendants touted to analysts and investors that Carvana sought to become the largest and most profitable automotive retailer. (Id.) Jenkins then explained that Carvana’s goal—to be the largest and most profitable automotive retailer—was attainable. (Id.) Jenkins explained that “the scalability of the online sales model, we believe, will lead to being a larger industry player than we’ve historically seen in automotive retail and more profitable player than we’ve historically seen due to a long- term lower cost structure.” (Id. (cleaned up).) The Consolidated Complaint further alleges that the Exchange Act Defendants touted to investors that Carvana could achieve its “lofty goals” due to its innovative business model. (Id. ¶ 54.) Specifically, the Exchange Act Defendants explained that “unlike traditional dealerships, Carvana’s e-commerce model offered structural cost advantages that enabled the Company to become more profitable as it grew in scale.” (Id.) C. Carvana’s Stock Price Decline Leading up to the Class Period, Carvana’s growth slowed and its stock price declined. (Id. ¶¶ 6, 134.) The Consolidated Complaint alleges that analysts expressed alarm. (Id. ¶ 134.) On February 27, 2020, for example, Morgan Stanley reported that: “If the growth starts to slow significantly, and the company is still not profitable, there will be a transition away from growth investors, and we believe that how investors think about the valuation of the stock will change.” (Id.) That same day, the Center for Financial Research and","A. The Parties 1. Plaintiffs Plaintiff UANPF is a Virginia-based, multi-employer defined benefit pension plan. (Doc. 36 ¶ 18.) UANPF is one of the nation’s largest Taft-Hartley funds with approximately $6.5 billion in assets held for the benefit of approximately 150,000 participants. (Id.) UANPF alleges it purchased a significant number of shares of Carvana Class A common stock at artificially inflated prices from May 6, 2020 to November 3, 2020 (the “Class Period”) and suffered damages from Defendants’ alleged misconduct. (Id.) On April 22, 2022, UANPF also purchased 1,455 shares of Class A common stock in the 2022 Public Offering (the “Offering”) from Citigroup Global Markets Inc. for $80.00 per share. (Id.) Plaintiff SHEPP is the largest defined benefit plan in the Canadian province of Saskatchewan. () It is a multi-employer defined benefit pension plan serving the healthcare sector, with over 60,000 members and more than $10 billion in assets under management. (Id.) SHEPP alleges it purchased a significant number of shares of Carvana Class A common stock at artificially inflated prices during the Class Period and suffered damages as a result of Defendants’ alleged misconduct. (Id.) On April 22, 2022, SHEPP purchased 3,838 shares of Class A common stock in the Offering from Citigroup Global Markets Inc. for $80.00 per share. (Id.) 2. Defendants Defendant Carvana Co. is a Delaware corporation with its principal executive offices located in Tempe, Arizona. (Doc. 36 ¶ 20.) Carvana’s Class A common stock trades on the New York Stock Exchange (“NYSE”) under the symbol “CVNA.” (Id.) Defendant Ernest Garcia III (“Garcia Junior”) is a co-founder of Carvana and has served as its Chief Executive Officer, President, and Chairman since 2012. () His father is Defendant Ernest Garcia II (“Garcia Senior”), who is also a founder of Carvana. (, 23.) Garcia Senior is Carvana’s controlling shareholder. () Plaintiffs allege that Garcia Senior was the largest single seller of Carvana stock throughout the Class Period and sold over $3.6 billion in Class A common stock at artificially inflated prices. (Id.) Plaintiffs also allege that Garcia Senior and Garcia Junior were next-door neighbors during the Class Period. (Id.) Defendant Mark Jenkins is Carvana’s Chief Financial Officer. () Plaintiffs allege that during the Class Period, Defendant Jenkins sold 336,929 shares, nearly 34% of his holdings, at artificially inflated prices for proceeds of $79,246,195. (Id.) Defendant Ryan Keeton is a co-founder of Carvana and serves as its Chief Brand Officer. () During the Class Period, Plaintiffs allege Keeton sold 180,007 shares of Carvana stock, or nearly 63% of his stock, at artificially inflated prices for proceeds of more than $42.3 million. (Id.) Defendant Benjamin Huston is a co-founder of Carvana and serves as its Chief Operating Officer. () During the Class Period, Huston sold 336,937 shares of Carvana stock, or more than 34% of his stock at, allegedly, artificially inflated prices, for proceeds of nearly $79.3 million. (Id.) Huston was responsible for Carvana operations, including inventory management and wholesale, inspection and reconditioning, logistics and fulfillment, customer service operations, real estate, and market expansion. (Id.) Plaintiffs allege that these Defendants—Carvana, Garcia Junior, Jenkins, Garcia Senior, Keeton, and Huston (collectively, the “Exchange Act Defendants”)—violated Section 10(b), Rule 10b-5, Section 20(a), and Section 20A of the Securities Exchange Act. Defendant Stephen Palmer served as Carvana’s Vice President of Accounting and Finance and signed the Registration Statement issued in connection with the 2022 Public Offering. () Defendants Michael Maroone, Neha Parikh, Ira Platt, and Greg Sullivan each served as members of Carvana’s Board of Directors and signed the Registration Statement issued in connection with the Offering. () Plaintiffs allege that these Defendants—Palmer, Maroone, Parikh, Platt, and Sullivan—together with Carvana, Garcia Junior, and Jenkins (collectively the “Individual Securities Act Defendants”) violated Section 11, Section 12(a)(2), and Section 15 of the Securities Act. 3. Underwriter Defendants Plaintiffs allege Defendants Citigroup Global Markets Inc. and J.P. Morgan Securities LLC acted as underwriters and/or underwriter representatives of, and as sellers in, Carvana’s 2022 Public Offering (collectively, the “Underwriter Defendants”). () Plaintiffs allege that in connection with the 2022 Public Offering, the Underwriter Defendants marketed Carvana common stock to potential investors using materially false or misleading information about the Company, or omitted material information required to be disclosed in the Registration Statement. () Plaintiffs also allege that the Underwriter Defendants caused the Registration Statement to be filed with the SEC and to be declared effective in connection with the 2022 Public Offering. (Id.) Plaintiffs claim this conduct deems them liable under the Securities Act. (Id.) B. Carvana’s Founding & Business Model Plaintiffs allege that Garcia Senior and his son, Garcia Junior—along with Keeton and Huston—founded Carvana as a wholly owned subsidiary of DriveTime Automotive (“DriveTime”), which was Garcia Senior’s used car business. (, 39, 41.) Carvana described itself as an “e-commerce company dealing in used cars” and “the Amazon of the used car industry.” () In 2017, the Garcias took Carvana public on the NYSE and pitched it as “a disrupter and innovator in the used car market.” () The Consolidated Complaint alleges Carvana marketed itself as a “seemingly limitless growth machine because the Company’s disruptive model was full of competitive advantages, such as a ‘capital-light’ expansion model, a scalable business model, and a groundbreaking logistics network that could readily deliver or pick-up cars nationwide.” () The Exchange Act Defendants marketed to investors that Carvana’s “business gets better as it gets bigger.” (Id.) Garcia Junior advertised that “a unique attribute of our business model relative to automotive retail and then not unique relative to e-commerce is that all of our cars are available to customers everywhere” and “you’re increasing conversion across all of your markets . . . we feel really, really good about that model.” () Carvana held its “first and only Analyst Day” on November 29, 2018. () There, Garcia Junior broadcasted that Carvana’s “long-term goal was to sell two million- plus units a year to become the largest automotive retailer.” (Id.) Plaintiffs further allege the Exchange Act Defendants touted to analysts and investors that Carvana sought to become the largest and most profitable automotive retailer. (Id.) Jenkins then explained that Carvana’s goal—to be the largest and most profitable automotive retailer—was attainable. (Id.) Jenkins explained that “the scalability of the online sales model, we believe, will lead to being a larger industry player than we’ve historically seen in automotive retail and more profitable player than we’ve historically seen due to a long- term lower cost structure.” (Id. (cleaned up).) The Consolidated Complaint further alleges that the Exchange Act Defendants touted to investors that Carvana could achieve its “lofty goals” due to its innovative business model. () Specifically, the Exchange Act Defendants explained that “unlike traditional dealerships, Carvana’s e-commerce model offered structural cost advantages that enabled the Company to become more profitable as it grew in scale.” (Id.) C. Carvana’s Stock Price Decline Leading up to the Class Period, Carvana’s growth slowed and its stock price declined. (, 134.) The Consolidated Complaint alleges that analysts expressed alarm. () On February 27, 2020, for example, Morgan Stanley reported that: “If the growth starts to slow significantly, and the company is still not profitable, there will be a transition away from growth investors, and we believe that how investors think about the valuation of the stock will change.” (Id.) That same day, the Center for Financial Research and"
cand-3_18-cv-04865.pdf,cand,99748,775,766,"This action is a consolidation of nine lawsuits.2 The Court granted Glen Littleton’s motion to serve as Lead Plaintiff under 15 U.S.C. § 78u-4(3)(B)(ii). Docket No. 152. Mr. Littleton subsequently filed the Consolidated Complaint on behalf of himself and those similarly situated. Docket No. 184 (“Compl.”). The Consolidated Complaint alleges Mr. Musk and Tesla violated Section 10(b) of the Securities Exchange Act of 1934, 15 U.S.C. §78j, and SEC Rule 10b-5, 17 C.F.R. 240.10b-5. Id. ¶ 1. It further alleges that Tesla’s Board of Directors violated Section 20(a) of the Securities Exchange Act, 15 U.S.C. § 78t. Id. This action seeks to represent a class of shareholders who purchased and/or sold Tesla stock from August 7, 2018 to August 17, 2018 (the “Class Period”). Id.","This action is a consolidation of nine lawsuits.2 The Court granted Glen Littleton’s motion to serve as Lead Plaintiff under 15 U.S.C. § 78u-4(3)(B)(ii). Docket No. 152. Mr. Littleton subsequently filed the Consolidated Complaint on behalf of himself and those similarly situated. Docket No. 184 (“Compl.”). The Consolidated Complaint alleges Mr. Musk and Tesla violated Section 10(b) of the Securities Exchange Act of 1934, 15 U.S.C. §78j, and SEC Rule 10b-5, 17 C.F.R. 240.10b-5. It further alleges that Tesla’s Board of Directors violated Section 20(a) of the Securities Exchange Act, 15 U.S.C. § 78t. Id. This action seeks to represent a class of shareholders who purchased and/or sold Tesla stock from August 7, 2018 to August 17, 2018 (the “Class Period”). Id."
